{
  "entryId": "ledger-us-000001",
  "at": "2026-08-20T09:10:00Z",
  "region": "us",
  "artefactId": "art-claims-openapi-us",
  "contentHash": "042896dc1966b8a6214e5383aba5b8b931cfa049d17aafa37eb8a77c859b95da",
  "classification": ["STRUCTURAL"],
  "verdict": "allow",
  "policyVersion": 3,
  "lawfulBasis": "legitimate-interest",
  "approver": null,
  "runId": "11111111-1111-1111-1111-111111111111",
  "prevHash": null,
  "hash": "dfd5922f5aa9441e95d21ed58bb9f2209a004912a1232e89f75f725bd37f3d4a",
  "signature": "sig-us-000001"
}
